### ISSUE TITLE
Doesn't always re-REGISTER on push even without a socket open

### ISSUE THREAD

**Issue by brianjmurrell** [BelledonneCommunications/linphone-android#1323]
**Describe the bug**
Doesn't always re-REGISTER when sent a push notification

**To Reproduce**
1. Configure Linphone to register to a SIP server
2. Wait a while
3. Send a push notification
4. Observe that Linphone doesn't re-register to the SIP server and that there is no current TCP socket open to the Linphone client on the SIP server.

**Expected behavior**
When not already connected on an open socket, when Linphone receives a push, it should re-REGISTER

**Please complete the following information**
 - Device: Huawei Honor 8
 - OS: Android 8.1
 - Version of the App 21a00a562
 - Version of the SDK c67027b
 
**SDK logs**
[Log](http://brian.interlinx.bc.ca/linphone-not-always-re-REGISTERING-on-push.txt)

In the above log, Linphone is being sent a push at :15 past every hour.
- at 0:15 it received a push, woke up and took 10 seconds to complete a REGISTER (pretty long)
- at 1:15, it received a push, woke up and took 10 seconds to complete a REGISTER (also pretty long) 
- at 2:15, a push was not even sent because it's TCP socket to the server was still connected
- at 3:15, it received a push, woke up and took 8 seconds to complete a REGISTER (still pretty long) 
- at 4:15, it received a push, woke up did not re-REGISTER and the socket on the server was closed
- at 5:15, same thing
- at 6:15 same thing
- at 7:15, it received a push, woke up and took 7 seconds to complete a REGISTER (still kind of long)
- at 8:15 it received a push, woke up and took 3 seconds to complete a REGISTER (better)
- at 9:15 it received a push, woke up and took 5 seconds to complete a REGISTER (not so much better)

**Comment by Viish** [comment]
> at 4:15, it received a push, woke up did not re-REGISTER and the socket on the server was closed
> at 5:15, same thing
> at 6:15 same thing

Not according to the client:
```
2021-03-22 04:15:02:791 [org.linphone.debug/linphone-android] MESSAGE [Push Notification] Notifying Core
2021-03-22 04:15:02:803 [org.linphone.debug/liblinphone] MESSAGE Push notification received
2021-03-22 04:15:02:806 [org.linphone.debug/belle-sip] MESSAGE bellesip_wake_lock_acquire(): Android wake lock [Push received] acquired [ref=0x2aba]
2021-03-22 04:15:02:806 [org.linphone.debug/belle-sip] MESSAGE bellesip_wake_lock_acquire(): cast long of wakelock 10938
2021-03-22 04:15:02:810 [org.linphone.debug/liblinphone] MESSAGE Started push notif background task [10938]
2021-03-22 04:15:02:815 [org.linphone.debug/liblinphone] MESSAGE Sending keep-alive to ensure sockets aren't broken
2021-03-22 04:15:02:818 [org.linphone.debug/belle-sip] MESSAGE channel [0x74d2a47540]: keep alive sent to [TCP://example.com:5060]
2021-03-22 04:15:22:831 [org.linphone.debug/liblinphone] WARNING Ending push received background task [10938]
```

>  at 0:15 it received a push, woke up and took 10 seconds to complete a REGISTER (pretty long)

It takes a while to register each time because your DNS server is quite slow... (fd31:aeb1:48df::2,10.75.22.247)
```
2021-03-22 00:15:09:385 [org.linphone.debug/belle-sip] MESSAGE DNS resolution awaiting response, queued to main loop
2021-03-22 00:15:10:376 [org.linphone.debug/belle-sip] MESSAGE resolver_process_data dns_res_check() in progress
2021-03-22 00:15:10:397 [org.linphone.debug/belle-sip] MESSAGE resolver_process_data dns_res_check() in progress
2021-03-22 00:15:10:397 [org.linphone.debug/belle-sip] MESSAGE resolver_process_data dns_res_check() in progress
2021-03-22 00:15:11:374 [org.linphone.debug/belle-sip] MESSAGE resolver_process_data dns_res_check() in progress
2021-03-22 00:15:11:392 [org.linphone.debug/belle-sip] MESSAGE resolver_process_data dns_res_check() in progress
2021-03-22 00:15:11:395 [org.linphone.debug/belle-sip] MESSAGE resolver_process_data dns_res_check() in progress
2021-03-22 00:15:11:411 [org.linphone.debug/belle-sip] MESSAGE SRV _sip._tcp.example.com resolved to [target:pbx.example.com. port:5060 prio:0 weight:0]
2021-03-22 00:15:11:411 [org.linphone.debug/belle-sip] MESSAGE Starting A/AAAA query for srv result [pbx.example.com]
2021-03-22 00:15:12:430 [org.linphone.debug/belle-sip] MESSAGE resolver_process_data dns_res_check() in progress
2021-03-22 00:15:13:423 [org.linphone.debug/belle-sip] MESSAGE resolver_process_data dns_res_check() in progress
2021-03-22 00:15:13:442 [org.linphone.debug/belle-sip] MESSAGE pbx.example.com resolved to 10.75.22.8
2021-03-22 00:15:13:443 [org.linphone.debug/belle-sip] MESSAGE A query finished for srv result [pbx.example.com]
2021-03-22 00:15:13:443 [org.linphone.debug/belle-sip] MESSAGE All A/AAAA results for combined resolution have arrived.
```

From the cold start of the app to receiving the 200 OK of the REGISTER 
```
2021-03-22 00:15:08:267 [org.linphone.debug/linphone-android] MESSAGE [Application] Core context created 
[...]
2021-03-22 00:15:13:470 [org.linphone.debug/belle-sip] MESSAGE channel [0x74d2a2ff40]: message sent to [TCP://example.com:5060], size: [997] bytes
REGISTER sip:example.com SIP/2.0
[...]
2021-03-22 00:15:13:589 [org.linphone.debug/belle-sip] MESSAGE channel [0x74d2a2ff40]: received [707] new bytes from [TCP://example.com:5060]:
SIP/2.0 200 OK
```
only 5 seconds have elapsed and not 10, and 4 of those 5 seconds were used to wait for your DNS server...

**Comment by Viish** [comment]
> My DNS server is not slow.

It is likely it doesn't support SRV records then.
Anyway you can try using a tool like dig or nslookup to check.

> Can/should Linphone ignore IPv6 resolvers

No.

**Comment by Viish** [comment]
> According to the server, there is no open socket to the client.

According to the client it is opened, and we even receive a few things (probably keep alives):
```
2021-03-22 04:15:02:129 [org.linphone.debug/belle-sip] MESSAGE channel [0x74d2a47540]: ending recv background task with id=[2b0a].
2021-03-22 04:15:02:131 [org.linphone.debug/belle-sip] MESSAGE bellesip_wake_lock_release(): Android wake lock released [ref=0x2b0a]
```
However it is possible a firewall or some other device between your server and your client is maintaining the socket alive for the client. Switching to TLS will prevent that.

**Comment by Viish** [comment]
You can try to edit your DNS settings on your WiFi router to remove the IPv6 address if you want to test without it.
You can also try to build this old branch I created 9 months ago because I thought IPv6 DNS might be an issue (and it was not, so it was never merged): `feature/allow_ipv6_dns_servers_to_be_disabled`. It does exactly what you want: remove IPv6 DNS server IP from DNS list if IPv6 is disabled at app level.

**Comment by brianjmurrell** [comment]
> You can try to edit your DNS settings on your WiFi router to remove the IPv6 address if you want to test without it.

Heh.  I wish I could.  Even when I do that, for some reason it's still including the previously configured IPv6 resolver in the RAs.  :-(  Bug I suppose.

> You can also try to build this old branch I created 9 months ago because I thought IPv6 DNS might be an issue (and it was not, so it was never merged): `feature/allow_ipv6_dns_servers_to_be_disabled`. It does exactly what you want: remove IPv6 DNS server IP from DNS list if IPv6 is disabled at app level.

Is that a linphone-android branch or an SDK branch?  I don't see it in the list of branches in linphone-android.

**Comment by Viish** [comment]
> Is that a linphone-android branch or an SDK branch?

SDK branch.

**Comment by brianjmurrell** [comment]
:-(  I have never had any luck building the SDK.

**Comment by brianjmurrell** [comment]
Before I continue spending more and more time on this, If it can be proven that using IPv6 resolvers is troublesome, will you consider doing something about it?  Or is this just an issue you just don't want to deal with and I'd be wasting my time?

FWIW, there is quite a bit of Q&A and discussion in various Internet forums about a number of vendors at least (if not ASOP itself) sleeping IPv6 even when they keep IPv4 awake on a dozing phone.  I suspect your instincts were not wrong when you created the feature/allow_ipv6_dns_servers_to_be_disabled branch.

**Comment by brianjmurrell** [comment]
Oh, and FWIW, you were correct about the client knowing it was still connected when receiving a push.  I had an error in my code on the server to detect if the client is still connected and it was only detecting it some of the time.

**Comment by Viish** [comment]
So far we haven't have a real proof of an IPv6 DNS issue, that's why the branch was never merged.
As of today you're the only one, so we won't make any change regarding this.
If in the future we see more reports of this kind of problem, we will take actions then.

**Comment by brianjmurrell** [comment]
It doesn't seem like proof that after linphone-android is woken by a push, after several seconds, the DNS requests it makes to REGISTER are on IPv4:

```
09:15:06.311518 IP 10.75.22.32.42241 > 10.75.22.247.domain: 16538+ SRV? _sip._tcp.example.com. (43)
09:15:06.311838 IP 10.75.22.247.domain > 10.75.22.32.42241: 16538* 1/1/5 SRV pbx.example.com.:5060 0 0 (219)
09:15:06.311898 IP 10.75.22.32.48189 > 10.75.22.247.domain: 14212+ A? example.com. (33)
09:15:06.312081 IP 10.75.22.247.domain > 10.75.22.32.48189: 14212* 0/1/0 (87)
09:15:08.344744 IP 10.75.22.32.36432 > 10.75.22.247.domain: 45804+ A? pbx.example.com. (37)
09:15:08.344967 IP 10.75.22.247.domain > 10.75.22.32.36432: 45804* 1/1/3 A 10.75.22.8 (146)
```

Rather than an IPv6 query, when we know (a) that linphone knows there is an IPv6 resolver and (b) that it tries that first, yet none of the packets from that query actually make it to the server and only the fall-back IPv4 query makes it.

> As of today you're the only one, so we won't make any change regarding this.

Given the hurdles to actually making linphone-android work with Google's push notifications, I wonder how many people are actually using push with linphone-android, with IPv6 and are analysing the performance of the push->wake->REGISTER as closely as I am.  I suspect that number is quite small.  As small as _1_ even.  :-)

What might be most interesting would be for linphone to do a happy-eyeballs DNS query when receiving a push and see how much more quickly the IPv4 response comes than the IPv6 response.  I suspect if you did that, you'd get more/better data on the poor performance/experience of IPv6 on sleeping phones.  phone this data home with all of the other phone-home stuff linphone does to gather some data.  linphone-android should probably even tell the user than IPv6 while sleeping on their phone performs poorly.
